,parsed,entities,labels,position_start,position_end,has_terms
C:\Users\shweata\dictionary\ethics_statement_project\stem_cell_2018\PMC6160434\sections\1_body\1_materials_and_methods\1_study_design__subjects__t\1_p.xml,"This was a single arm Phase II open label, single agent, multicenter clinical trial for subjects with HRNB who had completed standard therapy or therapy for refractory/relapsed disease. Subjects were enrolled onto the Beat Childhood Cancer Trial NMTRC003/003B from June 2012 to February 2016. This trial was approved by the Western Institutional Review Board as well as by local Institutional Review Boards at 22 enrolling hospitals across the United States (Saint Louis University Institutional Review Board, University of California San Diego Human Research Protections Program, Orlando Health/Orlando Regional Healthcare System Institutional Review Board, Medical University of South Carolina Institutional Review Board for Human Research, Chesapeake Research Review, Inc., Spectrum Health Institutional Review Board, Connecticut Children’s Medical Center Institutional Review Board, Children’s Mercy Hospital Pediatric Institutional Review Board, Institutional Review Board for Human Subjects for Baylor College of Medicine and Affiliated Hospitals, Vanderbilt University Human Research Protection Program, Phoenix Children’s Hospital Institutional Review Board, Seton Healthcare Institutional Review Board, Tufts University Health Sciences Institutional Review Board, University of Utah Institutional Review Board, Institutional Review Board of Children’s Hospitals and Clinics of Minnesota, Penn State Milton S. Hershey Medical Center – Penn State College of Medicine – Human Subjects Protection Office - Institutional Review Board, University of Texas Southwestern Medical Center Institutional Review Board, Johns Hopkins Medicine All Children’s Hospital Institutional Review Board, Albert Einstein College of Medicine Institutional Review Board and The Research Institute at Nationwide Children’s Hospital). Prior to study entry, written informed consent from the subject (if 18 or over), or from a parent and/or legal guardian (if under 18 y.o.) for study participation was obtained on all subjects. All methods were performed in accordance with relevant guidelines and regulations. ClinicalTrials.gov Identifiers: NCT01586260 Unique ID: NMTRC 003 Released 4/24/2012 as well as NCT02395666 Unique ID: NMTRC003B Released 3/5/2015.","[the Beat Childhood Cancer Trial NMTRC003/003B, June 2012 to February 2016, the Western Institutional Review Board, Institutional Review Boards, 22, the United States, Saint Louis University Institutional Review Board, University of California San Diego Human Research Protections Program, Orlando Health/Orlando Regional Healthcare System Institutional Review Board, Medical University of South Carolina Institutional Review Board for Human Research, Chesapeake Research Review, Inc., Spectrum Health Institutional Review Board, Connecticut Children’s Medical Center Institutional Review Board, Children’s Mercy Hospital Pediatric Institutional Review Board, Institutional Review Board for Human Subjects for Baylor College of Medicine and Affiliated Hospitals, Vanderbilt University Human Research Protection Program, Phoenix Children’s Hospital Institutional Review Board, Seton Healthcare Institutional Review Board, Tufts University Health Sciences Institutional Review Board, University of Utah Institutional Review Board, Institutional Review Board of Children’s Hospitals, Clinics of Minnesota, Penn State, University of Texas Southwestern Medical Center Institutional Review Board, Johns Hopkins Medicine All Children’s Hospital Institutional Review Board, Albert Einstein College, Medicine Institutional Review Board, The Research Institute, Nationwide Children’s Hospital, 18, under 18 y.o, 003, 4/24/2012, NCT02395666 Unique, 3/5/2015]","['ORG', 'DATE', 'ORG', 'ORG', 'CARDINAL', 'GPE', 'ORG', 'ORG', 'ORG', 'ORG', 'ORG', 'ORG', 'ORG', 'ORG', 'ORG', 'ORG', 'ORG', 'ORG', 'ORG', 'ORG', 'ORG', 'ORG', 'ORG', 'ORG', 'ORG', 'ORG', 'ORG', 'ORG', 'ORG', 'CARDINAL', 'DATE', 'CARDINAL', 'DATE', 'PERSON', 'CARDINAL']","[214, 265, 320, 379, 410, 440, 459, 510, 581, 659, 743, 777, 821, 887, 951, 1054, 1111, 1167, 1212, 1273, 1320, 1375, 1397, 1539, 1615, 1690, 1717, 1757, 1783, 1884, 1940, 2153, 2166, 2187, 2229]","[259, 291, 358, 406, 412, 457, 508, 579, 657, 741, 775, 819, 885, 949, 1052, 1109, 1165, 1210, 1271, 1318, 1370, 1395, 1407, 1613, 1688, 1713, 1752, 1779, 1813, 1886, 1952, 2156, 2175, 2205, 2237]",informed consent
C:\Users\shweata\dictionary\ethics_statement_project\stem_cell_2018\PMC6175065\sections\1_body\2_methods\1_mrc_myeloma_ix\1_p.xml,"Myeloma IX recruited patients with newly‐diagnosed MM aged ≥18 years from 120 centres in the United Kingdom between 2003 and 2007 and was registered with the appropriate organisation (ISRCTN68454111). All 120 centres reviewed the protocol and all recruited participants gave written informed consent in accordance with the Declaration of Helsinki, with an opt‐in component for the QoL sub‐study. The study was an open‐label randomised, phase III trial with a factorial design in which there were two randomisations. The first included randomised allocation of patients to receive a bisphosphonate (sodium clodronate or zoledronic acid) and induction treatment, either intensive or non‐intensive, determined by the treating clinicians’ assessments in combination with patient performance status and preferences following informed discussion. In the intensive pathway, patients were randomised to receive cyclophosphamide, vincristine, doxorubicin and dexamethasone (CVAD) or oral cyclophosphamide, thalidomide and dexamethasone (CTD) followed by high dose melphalan plus autologous stem cell transplant (ASCT). In the non‐intensive pathway, the randomisation was to attenuated CTD (CTDa) or melphalan and prednisolone (MP). A further randomisation allocated patients to either thalidomide maintenance therapy or observation only. Details of the trial, including the randomisation methods and sample size calculation, have been published elsewhere together with results of primary and secondary endpoints related to treatment effectiveness and safety (Morgan 
 ","[Myeloma, MM, ≥18 years, 120, the United Kingdom, between 2003 and 2007, 120, the Declaration of Helsinki, opt‐in, two, first, zoledronic, CTD, ASCT, CTD, Morgan 
 ]","['ORG', 'ORG', 'DATE', 'CARDINAL', 'GPE', 'DATE', 'CARDINAL', 'WORK_OF_ART', 'NORP', 'CARDINAL', 'ORDINAL', 'NORP', 'ORG', 'ORG', 'ORG', 'ORG']","[0, 51, 59, 74, 89, 108, 205, 319, 356, 496, 520, 619, 1028, 1103, 1176, 1550]","[7, 53, 68, 77, 107, 129, 208, 346, 362, 499, 525, 629, 1031, 1107, 1179, 1559]",informed consent
C:\Users\shweata\dictionary\ethics_statement_project\stem_cell_2018\PMC6195794\sections\1_body\3_methods\1_trial_design\1_p.xml,"We performed a phase 1/2 open-label multicenter dose-escalation trial in 12 adult participants to evaluate the safety and tolerability of subretinal transplantation of hESC-derived RPE cells. The intervention was unmasked. The study received the approval of the Medicines and Health Products Regulatory Authority, the United Kingdom Gene Therapy Advisory Committee, and the Moorfields Eye Hospital Research Governance Committee. We provided potential candidates with detailed information, including an explanation of the aims of the trial and the possible consequences of participation. Participants provided their written informed consent before enrolment. We performed the study in accordance with the tenets of the Declaration of Helsinki and registered the trial at 
 ","[1/2, 12, RPE, the Medicines and Health Products Regulatory Authority, the United Kingdom Gene Therapy Advisory Committee, the Moorfields Eye Hospital Research Governance Committee, the Declaration of Helsinki]","['CARDINAL', 'CARDINAL', 'ORG', 'ORG', 'GPE', 'ORG', 'WORK_OF_ART']","[21, 73, 181, 258, 314, 370, 714]","[24, 75, 184, 312, 364, 427, 741]",informed consent
C:\Users\shweata\dictionary\ethics_statement_project\stem_cell_2018\PMC6208687\sections\1_body\1_patients_and_methods\1_data_source\1_p.xml,"The TLN is an open, longitudinal, multicentre, observational, prospective cohort study, which started in 2009. The study was reviewed by the responsible ethics committee and registered at 
 ","[TLN, 2009]","['ORG', 'DATE']","[4, 105]","[7, 109]",ethics committee
C:\Users\shweata\dictionary\ethics_statement_project\stem_cell_2018\PMC6216432\sections\1_body\2_materials_and_methods\1_study_design_and_overview\1_p.xml,"This study was a phase I, single‐center, and open‐label trial of a single intravenous infusion of autologous umbilical cord blood in 25 children with ASD. All children were initially enrolled in a screening protocol to obtain medical records and information about their banked cord blood unit. All participants' caregivers completed a pre‐study screening interview by phone and provided medical records and videos for review by the study team to determine eligibility for the trial. Children with a confirmed diagnosis of ASD and a qualified banked autologous umbilical cord blood unit were eligible to participate. Written informed consent was obtained for both the screening and the treatment phases of the trial. The trial was approved by the Duke University Health System Institutional Review Board and conducted under IND #15949. Participants and their caregivers traveled to Duke University three times as part of their participation in the study. At their baseline visit, they were evaluated and received a single intravenous autologous cord blood infusion. At 6 and 12 months post‐infusion, participants returned for follow‐up clinical assessments. Additional caregiver interviews and questionnaires were collected at 3 and 9 months post‐infusion.","[25, ASD, ASD, the Duke University Health System Institutional Review Board, IND, Duke University, three, 6 and 12 months, 3 and 9 months]","['CARDINAL', 'ORG', 'ORG', 'ORG', 'ORG', 'ORG', 'CARDINAL', 'DATE', 'DATE']","[133, 150, 522, 742, 823, 881, 897, 1068, 1226]","[135, 153, 525, 802, 826, 896, 902, 1083, 1240]",informed consent
C:\Users\shweata\dictionary\ethics_statement_project\stem_cell_2018\PMC6224728\sections\1_body\2_methods__participants__in\8_recruitment\1_p.xml,"All patients with myeloma or lymphoma at Karolinska University Hospital and Uppsala University Hospital, and patients with myeloma at the University Hospitals in Linköping and Örebro who are to undergo ASCT will be asked to participate in the study. Information will be given at the time of stem cell apheresis and in material sent to the patient in connection with the invitation letter, with information about admission to the ward for ASCT. Inclusion in the study will take place after written consent on arrival at the ward to be admitted for ASCT. For underage patients (16–17 years), parents will also be informed and asked if they consent to their children’s participation. Estimated time for inclusion is approximately 1.5 years starting from 12
 ","[Karolinska University Hospital, Uppsala University Hospital, the University Hospitals, Linköping, Örebro, ASCT, ASCT, ASCT, (16–17 years, approximately 1.5 years, 12]","['ORG', 'ORG', 'ORG', 'GPE', 'ORG', 'ORG', 'ORG', 'ORG', 'DATE', 'DATE', 'CARDINAL']","[41, 76, 134, 162, 176, 202, 438, 547, 575, 713, 751]","[71, 103, 158, 171, 182, 206, 442, 551, 587, 736, 753]",written consent
C:\Users\shweata\dictionary\ethics_statement_project\stem_cell_2018\PMC6224728\sections\1_body\2_methods__participants__in\9_patient_and_public_involv\1_p.xml,Comparison of the balance between efficacy and safety for Cooral and ice in the prevention of OM is in the best interest of patients. Patients were not involved in the design of this study or in the recruitment or conduct of the study. The study results will be disseminated to study participants orally and in writing. The burden of the interventions will be assessed by the patients themselves. No patient advisers were involved in the design or conduct of the study.,"[Comparison, Cooral]","['ORG', 'ORG']","[0, 58]","[10, 64]",study participants
C:\Users\shweata\dictionary\ethics_statement_project\stem_cell_2018\PMC6224728\sections\1_body\5_methods__monitoring\4_auditing\1_p.xml,"The study will be monitored by KTA to ensure that it is carried out in accordance with the established study protocol, Helsinki declaration, ISO14155:2011 and other applicable guidelines and regulations. A monitoring plan has been established.","[KTA, Helsinki, ISO14155:2011]","['ORG', 'PERSON', 'ORG']","[31, 119, 141]","[34, 127, 154]",study protocol
C:\Users\shweata\dictionary\ethics_statement_project\stem_cell_2018\PMC6224728\sections\1_body\6_ethics_and_dissemination\1_protocol_amendments\1_p.xml,"Important protocol modifications will be communicated by KTA to investigators, trial participants, trial registries, review board, journals and regulators.",[KTA],['ORG'],[57],[60],review board
C:\Users\shweata\dictionary\ethics_statement_project\stem_cell_2018\PMC6224728\sections\1_body\6_ethics_and_dissemination\2_consent_or_assent\1_p.xml,"Written informed consent (online 
 ",[],[],[],[],informed consent
C:\Users\shweata\dictionary\ethics_statement_project\stem_cell_2018\PMC6278957\sections\1_body\1_methods\3_ethics\1_p.xml,Forty-six institutions participated in this study. The study was conducted in accordance with the principles of the Declaration of Helsinki. Written informed consent was obtained from each par ticipant before enrollment. The study was approved by the Ethics Committee of Akita University (N. 786) and by all institutional ethic committees that participated in this study. The study was registered with UMIN-CTR (UMIN000005904).,"[Forty-six, the Declaration of Helsinki, the Ethics Committee of Akita University]","['CARDINAL', 'WORK_OF_ART', 'ORG']","[0, 112, 247]","[9, 139, 287]",ethic committe
C:\Users\shweata\dictionary\ethics_statement_project\stem_cell_2018\PMC6303849\sections\1_body\1_methods_design\8_consent\1_p.xml,"The investigator will explain the details of this clinical trial to potential study subjects, and provide sufficient time for them to consider whether they will participate in the study. Voluntary informed consent will be obtained from the study subjects in a written form. Consent will be documented as being signed and dated by the study subject on the informed consent form. Consent will be obtained in a written form from a parent or a legal guardian or a legally acceptable representative when a study subject is legally incompetent.","[Voluntary, Consent, Consent]","['PERSON', 'ORG', 'ORG']","[187, 274, 378]","[196, 281, 385]",consent form
C:\Users\shweata\dictionary\ethics_statement_project\stem_cell_2018\PMC6303849\sections\1_body\1_methods_design\9_randomization_and_blindin\1_p.xml,"The study participants will be given a unique identification number, and they will be assigned to either the study-drug group or the control-placebo group. Randomization will be conducted using a web-based randomization program constructed by means of the blocked randomization method. The web-based randomization will be managed by the Medical Research Collaborating Center of Seoul National University Hospital (
 ",[the Medical Research Collaborating Center of Seoul National University Hospital],['ORG'],[333],[412],study participants
C:\Users\shweata\dictionary\ethics_statement_project\stem_cell_2018\PMC6311293\sections\1_body\1_2__material_and_methods\1_2_1__patients_and_image_s\1_p.xml,"Consecutive patients with newly diagnosed BM referred between 1.1.2011 and 31.12.2014 to radiotherapy at Masaryk Memorial Cancer Institute in Brno, Czech Republic, were included in this retrospective study. Patients with available MRI scan that revealed first BM were eligible for further analysis. This MRI was used to describe spatial distribution of BM in order to avoid bias of previous local treatment of BM in estimation of incidence of hippocampal BM. Basic clinical data was obtained from electronic medical records. All patients signed the informed consent allowing usage of their clinical and imaging data for research purposes in an anonymous form.","[between 1.1.2011 and 31.12.2014, Masaryk Memorial Cancer Institute, Brno, Czech Republic, first]","['CARDINAL', 'ORG', 'GPE', 'GPE', 'ORDINAL']","[54, 105, 142, 148, 254]","[85, 138, 146, 162, 259]",informed consent
C:\Users\shweata\dictionary\ethics_statement_project\stem_cell_2018\PMC6312024\sections\1_body\1_methods\1_study_population_and_chro\1_p.xml,"Research was conducted with informed consent, Institutional Review Board approval and in accordance with the Declaration of Helsinki. The clinical data used were from 339 patients with incident chronic GvHD enrolled in the Chronic GvHD Consortium study, a pre-existing multicenter prospective observational clinical database.
 ","[Institutional Review Board, the Declaration of Helsinki, 339, GvHD]","['ORG', 'WORK_OF_ART', 'CARDINAL', 'PERSON']","[46, 105, 167, 202]","[72, 132, 170, 206]",informed consent
C:\Users\shweata\dictionary\ethics_statement_project\stem_cell_2018\PMC6312036\sections\1_body\1_methods\1_study_design_and_patients\1_p.xml,"The RiBVD multicenter phase II trial enrolled newly diagnosed MCL patients ≥65 years or <65 years if ineligible or unwilling to undergo autologous stem cell transplantation. The study was conducted in 37 centers of the Lymphoma Study Association (LYSA) (NCT 01457144) and was approved by institutional review boards and ethics committees at all sites, and conducted according to the Declaration of Helsinki. The diagnosis of MCL was established according to the World Health Organization (WHO) 2008 criteria. Ki67 staining and scoring were performed centrally, according to European MCL Network recommendations.
 ","[II, MCL, ≥65 years or <65 years, 37, the Lymphoma Study Association, the Declaration of Helsinki, MCL, the World Health Organization (WHO, European MCL Network]","['ORG', 'ORG', 'DATE', 'CARDINAL', 'ORG', 'WORK_OF_ART', 'ORG', 'ORG', 'ORG']","[28, 62, 75, 201, 215, 379, 425, 458, 574]","[30, 65, 97, 203, 245, 406, 428, 492, 594]",ethics committee
C:\Users\shweata\dictionary\ethics_statement_project\stem_cell_2018\PMC6334730\sections\1_body\1_patients_and_methods\1_study_design\1_p.xml,"This multicenter, open-label study was conducted at 21 sites in Japan from January 2013 to February 2017. The study consisted of two parts: a phase 1 component designed to confirm the safety and tolerability of forodesine 300 mg twice-daily for 28 days in patients with relapsed/refractory PTCL and a phase 2 component designed to evaluate the efficacy and safety of this forodesine regimen in relapsed PTCL. The study was conducted in accordance with ethical principles of the Declaration of Helsinki and in compliance with International Council for Harmonization guidelines for Good Clinical Practice. The Institutional Review Boards of all participating institutions approved the study protocol, and all patients provided written informed consent. The study was registered at 
 ","[21, Japan, January 2013, February 2017, two, 1, 300, 28 days, PTCL, 2, the Declaration of Helsinki, International Council for Harmonization, Good Clinical Practice, The Institutional Review Boards]","['CARDINAL', 'GPE', 'DATE', 'DATE', 'CARDINAL', 'CARDINAL', 'CARDINAL', 'DATE', 'ORG', 'CARDINAL', 'WORK_OF_ART', 'ORG', 'ORG', 'ORG']","[52, 64, 75, 91, 129, 148, 222, 245, 290, 307, 474, 525, 580, 604]","[54, 69, 87, 104, 132, 149, 225, 252, 294, 308, 501, 564, 602, 635]",ethical principles
C:\Users\shweata\dictionary\ethics_statement_project\stem_cell_2018\PMC6342895\sections\1_body\2_methods\9_ethics_committee_analysis\1_p.xml,"This study has been evaluated and approved by our ethics committee, the Ethics Committee for Health of Centro Hospitalar de São João/Faculty of Medicine of Oporto University.",[the Ethics Committee for Health of Centro Hospitalar de São João/Faculty of Medicine of Oporto University],['ORG'],[68],[173],ethics committee
C:\Users\shweata\dictionary\ethics_statement_project\stem_cell_2018\PMC6365372\sections\1_body\1_subjects_and_methods\1_study_design\1_p.xml,"This was a prospective, phase IV, multicenter, randomized, open-label study conducted at seven sites in four countries: Taiwan, Republic of Korea, United States, and Canada (ClinicalTrials.gov Identifier: NCT01164475). The study was conducted in compliance with the Declaration of Helsinki, Good Clinical Practice guidelines, and the laws, regulations, and applicable guidelines of the relevant countries, and was approved by each institutional review board. All patients provided written informed consent.","[seven, four, Taiwan, Republic of Korea, United States, Canada, NCT01164475, the Declaration of Helsinki]","['CARDINAL', 'CARDINAL', 'GPE', 'GPE', 'GPE', 'GPE', 'PERSON', 'WORK_OF_ART']","[89, 104, 120, 128, 147, 166, 205, 262]","[94, 108, 126, 145, 160, 172, 216, 289]",informed consent
C:\Users\shweata\dictionary\ethics_statement_project\stem_cell_2018\PMC6391590\sections\1_body\3_materials_and_methods\1_study_design\1_p.xml,"We conducted a multicenter, open-label, randomized clinical trial to assess the safety, pharmacokinetics, and exploratory efficacy of intravenously administered JR-141 (NCT 03128593). The study was conducted in eight hospitals and specialized MPS centers in Japan and was in compliance with the Declaration of Helsinki. The protocol and patient informed consent were reviewed and approved by the Institutional Review Board at each participating institution.","[NCT 03128593, eight, MPS, Japan, the Declaration of Helsinki, the Institutional Review Board]","['DATE', 'CARDINAL', 'ORG', 'GPE', 'WORK_OF_ART', 'ORG']","[169, 211, 243, 258, 291, 392]","[181, 216, 246, 263, 318, 422]",informed consent
C:\Users\shweata\dictionary\ethics_statement_project\stem_cell_2018\PMC6391590\sections\1_body\3_materials_and_methods\2_participants_and_procedur\1_p.xml,"A total of 14 male patients were enrolled in the study. Two patients (aged 33 and 63) who had no intellectual disability and were able to recognize and verbally report their subjective symptoms were selected for the dose-escalation study (part 1) and were given 0.01, 0.1, 1.0, and 2.0 mg/kg/week of JR-141 intravenously. In part 2 of the study, the other 12 patients (average age, 12.9 years; range, 6 to 25 years; SD, 5.3), seven of whom had intellectual disability, were randomly assigned to a 1.0 or 2.0 mg/kg/week of JR-141 dosing group. Key inclusion criteria were as follows: age 6 years or older (16 years or older in the initial dose-escalation study) at the time of informed consent; a diagnosis of MPS II based on the measurement of overall IDS activity in leukocytes, plasma, and cultured skin fibroblasts along with a genetic analysis; under pharmacotherapy with idursulfase (0.5 mg/kg/week) for at least 12 weeks before the initial administration of JR-141. Key exclusion criteria included a history of hematopoietic stem cell transplantation, practical inability to undergo lumbar puncture, serious drug allergy or hypersensitivity making them unsuitable for participation in the study, a history of receiving other investigational products within 4 months before the beginning of this study. All patients or legally acceptable representatives provided signed informed consent prior to enrolment. Full inclusion and exclusion criteria are listed in the appendix, and the study protocol is available online.","[14, Two, 33 and 63, 1, 0.01, 0.1, 1.0, 2.0, 2, 12, 12.9 years, 6 to 25 years, 5.3, seven, 1.0, 2.0, age 6 years or older, 16 years, 0.5, at least, 4 months]","['CARDINAL', 'CARDINAL', 'DATE', 'CARDINAL', 'CARDINAL', 'CARDINAL', 'CARDINAL', 'CARDINAL', 'CARDINAL', 'CARDINAL', 'DATE', 'DATE', 'CARDINAL', 'CARDINAL', 'CARDINAL', 'CARDINAL', 'DATE', 'DATE', 'CARDINAL', 'CARDINAL', 'DATE']","[11, 56, 75, 244, 262, 268, 273, 282, 330, 356, 382, 401, 420, 426, 497, 504, 583, 605, 889, 909, 1263]","[13, 59, 84, 245, 266, 271, 276, 285, 331, 358, 392, 414, 423, 431, 500, 507, 603, 613, 892, 917, 1271]",informed consent
C:\Users\shweata\dictionary\ethics_statement_project\stem_cell_2018\PMC6418329\sections\1_body\1_materials_and_methods\5_ethics\1_p.xml,"The study protocol was approved by the Ethics Committee of The Islamic Azad University of Mashhad with this code (IR.IAU.MSHD.REC.1396.115). The patients filled in a written informed consent prior to study entry. The questionnaires were anonymous, and all collected data were regarded as confidential.",[the Ethics Committee of The Islamic Azad University],['ORG'],[35],[86],informed consent
C:\Users\shweata\dictionary\ethics_statement_project\stem_cell_2018\PMC6418329\sections\1_body\5_acknowledgment\1_p.xml,"The authors would like to thank the study participants and coordinators, the medical and paramedical staff at the participating institutions.",[],[],[],[],study participants
