,parsed,entities,labels,position_start,position_end,has_terms
C:\Users\shweata\dictionary\ethics_statement_project\stem_cell_2018\PMC6425108\sections\1_body\5_ethical_considerations\1_p.xml,"All procedures described herein were performed in compliance with the scientific and ethics committees of the Hospital Angeles Pedregal, the Declaration of Helsinki, and approved by the Comisión Federal para la Protección de Riesgos Sanitarios (COFEPRIS, CMN2012-027). Fetal tissue was obtained in 1998 at Good Samaritan Hospital (Los Angeles, CA) with institutional approval #97-11-01, within their neuro-transplantation program. Human fetal brain tissue donor informed consent forms were obtained in accordance with NIH guidelines for use of fetal tissue (available from: 
 ","[the Hospital Angeles Pedregal, the Declaration of Helsinki, Comisión, la Protección de Riesgos Sanitarios, COFEPRIS, CMN2012-027, 1998, Good Samaritan Hospital, Los Angeles, #97-11-01, NIH]","['ORG', 'WORK_OF_ART', 'ORG', 'PERSON', 'ORG', 'PRODUCT', 'DATE', 'ORG', 'GPE', 'MONEY', 'ORG']","[106, 137, 186, 208, 245, 255, 298, 306, 331, 376, 518]","[135, 164, 194, 243, 253, 266, 302, 329, 342, 385, 521]",consent form
C:\Users\shweata\dictionary\ethics_statement_project\stem_cell_2018\PMC6442956\sections\1_body\1_methods\1_patients_and_donors\1_p.xml,"This retrospective study included all consecutive adult patients who received a first alternative donor HCT for any underlying diagnosis at Fred Hutchinson Cancer Research Center/Seattle Cancer Care Alliance between 2006 and 2015 and subsequently developed chronic GvHD that required systemic treatment. The alternative grafts included unrelated 4–6/6-HLA-matched single or double umbilical cord blood units (UCB), related HLA-haploidentical bone marrow or mobilized peripheral blood stem cells plus post-transplant cyclophosphamide (Haplo/PTCY), and mobilized peripheral blood stem cells from unrelated donors with a single HLA allele mismatched at an A, B, C or DRB1 locus by high resolution typing (1-mMUD), regardless of whether the mismatch resulted in antigen disparity at the locus. Patients had given written consent allowing the use of medical records for research in accordance with the Declaration of Helsinki, and the institutional review board approved the study.","[first, HCT, Fred Hutchinson Cancer Research Center/, between 2006 and 2015, GvHD, 4–6/6, UCB, Haplo/PTCY, the Declaration of Helsinki]","['ORDINAL', 'ORG', 'ORG', 'DATE', 'PERSON', 'CARDINAL', 'ORG', 'ORG', 'WORK_OF_ART']","[80, 104, 140, 208, 265, 346, 409, 534, 893]","[85, 107, 179, 229, 269, 351, 412, 544, 920]",institutional review
C:\Users\shweata\dictionary\ethics_statement_project\stem_cell_2018\PMC6442960\sections\1_body\1_methods\1_p.xml,"This was a retrospective observational study. All patients diagnosed with CLL according to the World Health Organization criteria from 2007 to 2013 were identified from the National Cancer Registry. A representative physician from each of Sweden’s six health-care regions reviewed all the patient files in the region to identify patients who had received first-line CLL treatment due to progressive, symptomatic CLL. Patients who had started therapy before the end of 2013 were included in order to obtain sufficient follow up. Their files were analyzed in detail from the date of diagnosis until death or until the end of the study period (2017), whichever came first. Patients who had only received treatment for autoimmune hemolysis or idiopathic thrombocytopenic purpura (ITP) not related to progressive CLL were excluded. As this was a retrospective observational study, ethics committee approval (2013/952–31/3) was obtained; in Sweden no informed patient consent was required. The study was performed in accordance with the ethical principles of the Declaration of Helsinki
 ","[CLL, the World Health Organization, 2007, 2013, the National Cancer Registry, Sweden, six, first, CLL, CLL, 2017, first, ITP, CLL, Sweden, the Declaration of Helsinki
 ]","['ORG', 'ORG', 'DATE', 'DATE', 'ORG', 'GPE', 'CARDINAL', 'ORDINAL', 'ORG', 'ORG', 'DATE', 'ORDINAL', 'ORG', 'ORG', 'GPE', 'WORK_OF_ART']","[74, 91, 135, 143, 169, 239, 248, 355, 366, 412, 641, 663, 776, 808, 935, 1053]","[77, 120, 139, 147, 197, 245, 251, 360, 369, 415, 645, 668, 779, 811, 941, 1082]",ethical principles
C:\Users\shweata\dictionary\ethics_statement_project\stem_cell_2018\PMC6714858\sections\1_body\1_patients_and_methods\1_p.xml,"All the participating children and parents were informed about the study, and informed consent was received. The study was approved by the Ethics Committee of Erciyes University Medical Faculty with no: TTU2016-6579 and was also supported by the Erciyes University Research Project Management Unit under the project designated as TTU2016-6579.","[the Ethics Committee of Erciyes University Medical Faculty, the Erciyes University Research Project Management Unit, TTU2016-6579]","['ORG', 'ORG', 'ORG']","[135, 242, 330]","[193, 297, 342]",informed consent
C:\Users\shweata\dictionary\ethics_statement_project\stem_cell_2018\PMC6760546\sections\1_body\1_patients_and_methods\1_patients’_eligibility\1_p.xml,"Total 32 eligible patients were enrolled into the clinical trial with ages from 20- to 62-year-old with hematologic malignancies including acute myeloid leukemia (AML), acute lymphoblastic leukemia (ALL), high-risk myelodysplasia (MDS), chronic myelomonocytic leukemia (CMML) from June 2017 to January 2018 in our center. ECOG performance status was ≤2 in all patients. All patients had adequate baseline laboratory values for eligibility. This study had ethical approval from the local ethical committees and conducted in accordance with the Declaration of Helsinki. All patient data originate from clinical trials with mandatory written informed consent.","[62-year-old, AML, CMML, June 2017 to January 2018, the Declaration of Helsinki]","['DATE', 'ORG', 'ORG', 'DATE', 'WORK_OF_ART']","[87, 163, 270, 281, 539]","[98, 166, 274, 306, 566]",ethical approval
C:\Users\shweata\dictionary\ethics_statement_project\stem_cell_2018\PMC8059405\sections\1_body\1_methods\1_study_design\1_p.xml,"This multicenter, open-label study was conducted in accordance with Good Clinical Practice, per the International Conference on Harmonization Guideline E6, and with ethical principles outlined in the Declaration of Helsinki. The protocol was approved by the institutional review boards of all participating centers. All patients provided written informed consent. This study is registered at 
 ","[Good Clinical Practice, the International Conference on Harmonization Guideline E6, the Declaration of Helsinki]","['ORG', 'ORG', 'WORK_OF_ART']","[68, 96, 196]","[90, 154, 223]",ethical principles
