,parsed,entities,labels,position_start,position_end,has_terms
C:\Users\shweata\dictionary\ethics_statement_project\stem_cell_2018\PMC6050722\sections\1_body\1_methods\1_study_design_and_patient_\1_p.xml,"In this study, a total of 726 patients were enrolled at Xiangya Hospital, Central South University between May 2009 and Feb 2017. This study was approved by the Ethics Committee of Institute of Clinical Pharmacology of Central South University (No. CTXY-120025-2) and conducted in compliance with the provisions of the Declaration of Helsinki (Chinese Clinical Trial Register: ChiCTR-PPC-14005297). All patients provided written informed consent that explicitly included genetic information sharing with qualified investigators before enrollment.","[726, Xiangya Hospital, Central South University, May 2009, Feb 2017, the Ethics Committee of Institute of Clinical Pharmacology of Central South University, the Declaration of Helsinki]","['CARDINAL', 'ORG', 'ORG', 'DATE', 'DATE', 'ORG', 'WORK_OF_ART']","[26, 56, 74, 107, 120, 157, 315]","[29, 72, 98, 115, 128, 243, 342]",informed consent
C:\Users\shweata\dictionary\ethics_statement_project\stem_cell_2018\PMC6055619\sections\1_body\5_conflict‐of‐interest_disc\1_p.xml,"P.G.R. reports advisory board participation for Celgene, Novartis and Takeda. C.C.H. reports research funding from Takeda, Celgene, ARNO Therapeutics, Janssen Pharmaceuticals, Karyopharm and Merck, and advisory board participation for Thrassos and InCyte. C.A.R. reports independent review committee membership for Millennium/Takeda clinical trial NCT01564537, advisory committee membership for Millennium, and consultancy fees from Celgene and Bristol Myers Squibb. D.H.V. reports stock ownership in Amgen, and honoraria from Celgene, Takeda, Janssen and Amgen. J.G.B. reports research funding from AbbVie, Acetylon, Amgen, Bluebird, Bristol Myers Squibb, Calithera, Celgene, Constellation, Curis, Epizyme, Janssen, Karyopharm, Kesios, Novartis, Onyx, Takeda and Tragara. M.L. reports research funding from Celgene and Takeda, and advisory board participation for Takeda. A.C. reports research funding from and advisory board participation for Millennium/Takeda, Celgene, Array Bio Pharma, Novartis Pharmaceuticals and Onyx, research funding from Janssen Pharmaceuticals and Bristol Myers Squibb, and consultancy fees from Janssen Pharmaceuticals and Bristol Myers Squibb. S.D.S. reports research funding from Seattle Genetics, Merck Sharp and Dohme Corp, Janssen Research and Development, LLC, Acerta Pharma BV, Pharmacyclics, Genentech and Portola Pharmaceuticals. N.R. reports consultancy for Onyx, Amgen, Millennium and Celgene. C.B., N.G. and D.B. report employment by Millennium Pharmaceuticals Inc., a wholly owned subsidiary of Takeda Pharmaceutical Company Limited. E.L. reports previous employment by Millennium Pharmaceuticals Inc., a wholly owned subsidiary of Takeda Pharmaceutical Company Limited. A.D.B. and J.E. report stock ownership in and employment by Millennium Pharmaceuticals Inc., a wholly owned subsidiary of Takeda Pharmaceutical Company Limited. R.B. reports honoraria from Celgene and research funding (to his institution) from Celgene, Takeda, Karyopharm, Merck, Bristol Myers Squibb, Novartis and Signal Genetics. M.H. and D.L. declare no competing financial interests.","[Takeda, C.C.H., Janssen Pharmaceuticals, Karyopharm, Merck, Thrassos, InCyte, C.A.R., Millennium/Takeda, NCT01564537, Millennium, Bristol Myers Squibb, Amgen, Janssen, Amgen, AbbVie, Acetylon, Amgen, Bluebird, Bristol Myers Squibb, Calithera, Karyopharm, Kesios, Takeda, Tragara, M.L., Takeda, Takeda, A.C., Millennium/Takeda, Celgene, Janssen Pharmaceuticals, Bristol Myers Squibb, Janssen Pharmaceuticals, Bristol Myers Squibb, S.D.S., Seattle Genetics, Merck Sharp, Dohme Corp, Janssen Research and Development, LLC, Acerta Pharma BV, Pharmacyclics, Genentech, Portola Pharmaceuticals, N.R., Onyx, C.B., N.G., D.B., Millennium Pharmaceuticals Inc., Takeda Pharmaceutical Company Limited, E.L., Millennium Pharmaceuticals Inc., Takeda Pharmaceutical Company Limited, J.E., Millennium Pharmaceuticals Inc., Takeda Pharmaceutical Company Limited, R.B., Takeda, Karyopharm, Merck, Bristol Myers Squibb, Novartis, Signal Genetics, M.H., D.L.]","['PERSON', 'ORG', 'ORG', 'PERSON', 'ORG', 'PERSON', 'PERSON', 'ORG', 'ORG', 'PRODUCT', 'EVENT', 'ORG', 'ORG', 'PERSON', 'ORG', 'ORG', 'PERSON', 'ORG', 'PERSON', 'ORG', 'ORG', 'GPE', 'GPE', 'PERSON', 'GPE', 'PERSON', 'PERSON', 'PERSON', 'GPE', 'ORG', 'ORG', 'ORG', 'ORG', 'ORG', 'ORG', 'ORG', 'ORG', 'ORG', 'ORG', 'ORG', 'PERSON', 'ORG', 'ORG', 'ORG', 'GPE', 'ORG', 'ORG', 'GPE', 'ORG', 'ORG', 'ORG', 'PERSON', 'ORG', 'ORG', 'PERSON', 'ORG', 'ORG', 'GPE', 'PERSON', 'PERSON', 'GPE', 'ORG', 'ORG', 'ORG', 'PERSON', 'GPE']","[70, 78, 151, 176, 191, 235, 248, 256, 315, 348, 395, 445, 501, 544, 556, 600, 608, 618, 625, 635, 657, 717, 729, 753, 764, 773, 820, 865, 873, 945, 1048, 1076, 1124, 1152, 1174, 1211, 1229, 1245, 1257, 1291, 1296, 1314, 1329, 1343, 1368, 1397, 1434, 1440, 1449, 1475, 1537, 1576, 1612, 1674, 1724, 1773, 1835, 1874, 1966, 1974, 1986, 1993, 2015, 2028, 2045, 2054]","[76, 84, 174, 186, 196, 243, 254, 262, 332, 359, 405, 465, 506, 551, 561, 606, 616, 623, 633, 655, 666, 727, 735, 759, 771, 777, 826, 871, 877, 971, 1071, 1096, 1147, 1172, 1180, 1227, 1240, 1255, 1289, 1294, 1312, 1327, 1338, 1366, 1372, 1401, 1438, 1444, 1453, 1506, 1574, 1580, 1643, 1711, 1728, 1804, 1872, 1878, 1972, 1984, 1991, 2013, 2023, 2043, 2049, 2058]",review committee
C:\Users\shweata\dictionary\ethics_statement_project\stem_cell_2018\PMC6057940\sections\1_body\3_methods\17_patients\1_p.xml,"Patients in this study were enrolled in the GEICAM/2012-12 (EDALINE) clinical trial (ClinicalTrials.gov Identifier: NCT02027376); a single-arm, open-label, phase I, 3 + 3 dose escalation study in which patients with TNBC were treated with the SMOi Sonidegib (LDE-225) in combination with docetaxel to determine the MTD and the Recommended Phase II Dose (RP2D), as the primary objective. Written informed consent was obtained from all patients and documented before performing any protocol-specific procedure. The study was conducted in accordance with the International Conference on Harmonization Good Clinical Practice Guidelines (ICH GCP), the Declaration of Helsinki and applicable local regulatory requirements and laws. The protocol was approved by the Institutional Review Board and the Ethics Committee of all the participating sites (Hospital General Universitario Gregorio Marañón, Hospital Universitario Clínico San Carlos, Complejo Hospitalario Universitario A Coruña, Hospital Universitario Virgen del Rocío, Hospital Universitario Virgen de la Victoria), according to the requirements of the Spanish regulations (GEICAM/2012-12; clinicaltrials.gov identifier: NCT02027376). Eligible patients, with no more than three previous lines of chemotherapy for metastatic disease were treated with 21-day cycles of intravenous docetaxel 75 mg/m
 ","[3, TNBC, MTD, the International Conference on Harmonization Good Clinical Practice Guidelines, the Declaration of Helsinki, the Institutional Review Board, the Ethics Committee, Hospital, Marañón,, Complejo Hospitalario Universitario, Virgen del Rocío, Hospital Universitario Virgen de la Victoria, Spanish, GEICAM/2012-12, no more than three, 21-day, 75]","['CARDINAL', 'ORG', 'ORG', 'ORG', 'WORK_OF_ART', 'ORG', 'ORG', 'ORG', 'ORG', 'PERSON', 'ORG', 'NORP', 'ORG', 'CARDINAL', 'DATE', 'CARDINAL']","[165, 216, 315, 552, 643, 755, 790, 843, 883, 935, 1004, 1106, 1127, 1212, 1303, 1342]","[166, 220, 318, 631, 670, 785, 810, 851, 891, 970, 1066, 1113, 1141, 1230, 1309, 1344]",informed consent
C:\Users\shweata\dictionary\ethics_statement_project\stem_cell_2018\PMC6057940\sections\1_body\3_methods\5_animals_and_surgery\1_p.xml,"All animal procedures were carried out in accordance with relevant national and international guidelines and according to the animal protocol approved by the Garvan/St Vincent’s Animal Ethics Committee (Animal ethics number 11/46). M6-Ctrl or M6-Hh (0.75×10
 ","[Garvan, St Vincent’s, 11/46, M6-Ctrl]","['ORG', 'PERSON', 'CARDINAL', 'PERSON']","[158, 165, 224, 232]","[164, 177, 229, 239]",national guidelines
C:\Users\shweata\dictionary\ethics_statement_project\stem_cell_2018\PMC6064619\sections\1_body\1_methods_design\9_timelines\1_p.xml,Ethics approval was obtained from the Human Research Ethics Committee of the University of Melbourne in October 2016. Ethics approval was obtained from the North Sydney Local Health Districts ethics committee in March 2017 and governance approval from the Northern Sydney Local Health Districts Governance office in July 2017. Recruitment commenced in August 2017 and is anticipated to be completed in December 2019. The trial is due for completion in December 2020 when all participants will have completed 12-month follow-up.,"[the Human Research Ethics Committee, the University of Melbourne, October 2016, the North Sydney Local Health Districts, March 2017, the Northern Sydney Local Health Districts Governance, July 2017, August 2017, December 2019, December 2020, 12-month]","['ORG', 'ORG', 'DATE', 'ORG', 'DATE', 'ORG', 'DATE', 'DATE', 'DATE', 'DATE', 'DATE']","[34, 73, 104, 152, 212, 252, 316, 352, 402, 452, 508]","[69, 100, 116, 191, 222, 305, 325, 363, 415, 465, 516]",ethics committee
C:\Users\shweata\dictionary\ethics_statement_project\stem_cell_2018\PMC6066484\sections\1_body\1_patients_and_methods\6_statistical_analyses\1_p.xml,"The primary end point of the phase 1 portion of this trial was to assess the maximum tolerated dose (MTD). The phase 1 portion of the study was expected to require a minimum of 6 and a maximum of 12 evaluable patients. For the phase 2 portion of this trial, the primary end point was the rate of complete or very good partial response. A success was defined as a CR or VGPR noted as the objective status on two consecutive evaluations. All patients meeting the eligibility criteria who signed a consent form and received at least one dose of the drug were evaluable for response, with the exception of patients who were determined to be a major treatment violation. The sample size for the phase 2 portion of the study was calculated using a one-stage binomial design. The 6 patients treated at the MTD in the phase 1 portion were also included in the phase 2 portion for overall sample size estimation. A maximum of 35 additional evaluable patients were planned to be accrued at the MTD dose level for a maximum of 41 evaluable patients in the phase 2 portion of this study. An additional 4 patients were accrued to account for ineligibility, cancellation, major treatment violation, or other reasons. With 41 evaluable patients, the study provided 90% power to test the null hypothesis that the ≥ VGPR rate is at most 40% vs. the alternative hypothesis that the ≥ VGPR rate is at least 60%, with a 1-sided significance level of 
 ","[1, 1, 6, 12, 2, CR, VGPR, two, at least one, 2, one, 6, MTD, 1, 2, 35, MTD, 41, 2, An additional 4, 41, 90%, ≥, most 40%, ≥, at least 60%, 1]","['CARDINAL', 'CARDINAL', 'CARDINAL', 'CARDINAL', 'CARDINAL', 'PERSON', 'PERSON', 'CARDINAL', 'CARDINAL', 'CARDINAL', 'CARDINAL', 'CARDINAL', 'ORG', 'CARDINAL', 'CARDINAL', 'CARDINAL', 'ORG', 'CARDINAL', 'CARDINAL', 'CARDINAL', 'CARDINAL', 'PERCENT', 'PERSON', 'PERCENT', 'PERSON', 'PERCENT', 'CARDINAL']","[35, 117, 177, 196, 233, 363, 369, 407, 521, 696, 742, 773, 799, 816, 858, 917, 984, 1016, 1051, 1076, 1208, 1250, 1297, 1315, 1364, 1379, 1400]","[36, 118, 178, 198, 234, 365, 373, 410, 533, 697, 745, 774, 802, 817, 859, 919, 987, 1018, 1052, 1091, 1210, 1253, 1298, 1323, 1365, 1391, 1401]",consent form
C:\Users\shweata\dictionary\ethics_statement_project\stem_cell_2018\PMC6070095\sections\1_body\3_methods\1_patients_and_clinical_pro\1_p.xml,"We reviewed 53 consecutive adults with relapsed or refractory B-ALL who received 19-28z CAR T cells at MSKCC in a phase I clinical trial (NCT01044069) from May 2010 until August 2016 when the study was completed. This historical cohort study was reviewed and approved by the institutional review board at MSKCC. Details regarding the study design were described elsewhere [
 ","[53, 19-28z, NCT01044069, May 2010, August 2016, MSKCC]","['CARDINAL', 'DATE', 'ORG', 'DATE', 'DATE', 'PERSON']","[12, 81, 138, 156, 171, 305]","[14, 87, 149, 164, 182, 310]",institutional review
C:\Users\shweata\dictionary\ethics_statement_project\stem_cell_2018\PMC6078186\sections\1_body\1_patients_and_methods\1_study_design\1_p.xml,"This study was conducted in accordance with the ethical principles of Good Clinical Practice and to the latest Declaration of Helsinki amendment. It was reviewed and approved by Severance Hospital Institutional Review Board, and the study information was registered on 
 ","[Good Clinical Practice, Severance Hospital Institutional Review Board]","['ORG', 'ORG']","[70, 178]","[92, 223]",ethical principles
C:\Users\shweata\dictionary\ethics_statement_project\stem_cell_2018\PMC6078186\sections\1_body\1_patients_and_methods\3_procedures\1_p.xml,"After providing written informed consent, the subjects attended an initial screening visit to undergo screening procedures between 2 and 28 days prior to the first dosing. On Day −1, eligible subjects were admitted to the clinical trials center at Severance Hospital and randomized. After an overnight fast, subjects were administered a single dose of filgrastim on the early morning of Day 1. Either the test or reference drug was administered by the pre-assigned sequence. Blood was drawn for PK and PD evaluation at prespecified time points. On Day 3, the subjects had 48-hour PK/PD samples drawn, underwent a repeated safety assessment, and were discharged from the site. PD sampling after discharge was performed via subsequent visits according to a predetermined time schedule. After a 28-day washout period, period 2 was conducted in a crossover manner. On Day 14±2 of period 2, subjects underwent a follow-up visit for final safety assessments. During the hospital stay and at follow-up, adverse event (AE) monitoring, concomitant medication recording, laboratory analyses (hematology, blood chemistry, coagulation, urinalysis), physical examination, vital signs (blood pressure, pulse rate, and body temperature), and 12-lead ECG were also performed. To examine drug immunogenicity, anti-filgrastim antibodies test was performed at each admission and follow-up.","[2 and 28 days, first, Day −1, Severance Hospital, the early morning of Day 1, Day 3, 48-hour, 28-day, 2, Day 14±2, 2, AE, 12, ECG]","['DATE', 'ORDINAL', 'DATE', 'ORG', 'TIME', 'DATE', 'TIME', 'DATE', 'CARDINAL', 'DATE', 'CARDINAL', 'ORG', 'CARDINAL', 'ORG']","[131, 158, 175, 248, 366, 548, 572, 792, 822, 864, 883, 1011, 1227, 1235]","[144, 163, 181, 266, 392, 553, 579, 798, 823, 872, 884, 1013, 1229, 1238]",informed consent
C:\Users\shweata\dictionary\ethics_statement_project\stem_cell_2018\PMC6104757\sections\1_body\3_ethics_and_dissemination\1_p.xml,"The study will be conducted according to the principles of the Declaration of Helsinki (Adopted by the 18th World Medical Association (WMA) General Assembly, Helsinki, Finland, June 1964 and amended by the 64th WMA General Assembly, Fortaleza, Brazil, October 2013) and in accordance with the Dutch Medical Research Involving Human Subjects Act (WMO). The study has been approved by the Dutch Central Committee on Research Concerning Human Subjects (protocol number NL51705.000.15).","[the Declaration of Helsinki (Adopted, 18th, World Medical Association, WMA, General Assembly, Helsinki, Finland, June 1964, 64th, WMA General Assembly, Fortaleza, Brazil, October 2013, the Dutch Medical Research Involving Human Subjects Act, the Dutch Central Committee on Research Concerning Human Subjects, NL51705.000.15]","['WORK_OF_ART', 'ORDINAL', 'ORG', 'ORG', 'ORG', 'GPE', 'GPE', 'DATE', 'ORDINAL', 'ORG', 'GPE', 'GPE', 'DATE', 'ORG', 'ORG', 'ORG']","[59, 103, 108, 135, 140, 158, 168, 177, 206, 211, 233, 244, 252, 289, 383, 466]","[95, 107, 133, 138, 156, 166, 175, 186, 210, 231, 242, 250, 264, 344, 448, 480]",protocol number
C:\Users\shweata\dictionary\ethics_statement_project\stem_cell_2018\PMC6137884\sections\1_body\2_results\1_patient_characteristics\1_p.xml,"Between December 2013 and November 2016, 10 consecutive patients were enrolled and followed up for a period of 12 months according to the study protocol. Baseline characteristics are presented in Table 
 ","[Between December 2013 and November 2016, 10, 12 months, Baseline, Table]","['DATE', 'CARDINAL', 'DATE', 'PERSON', 'ORG']","[0, 41, 111, 154, 196]","[39, 43, 120, 162, 201]",study protocol
C:\Users\shweata\dictionary\ethics_statement_project\stem_cell_2018\PMC6138767\sections\1_body\5_materials_and_methods\2_study_design\1_p.xml,This randomized phase II trial compared ICT/CCRT with CCRT. The PUL regimen was administered biweekly during ICT and CCRT. Eligible patients were stratified into 4 groups on the basis of 2 factors: tumor resectability (resectable vs unresectable) and disease stage (III vs IV). A consensus on resectability was provided by a multidisciplinary team. Randomization codes were generated independently for each stratum. A permuted block randomization scheme was used to generate the randomization codes so that the number of patients assigned to the 2 treatment arms was approximately equal. The institutional review board of our institution approved this study. Written informed consent was obtained from all patients before therapy.,"[II, ICT, PUL, ICT, CCRT, 4, 2, 2]","['ORG', 'ORG', 'ORG', 'ORG', 'ORG', 'CARDINAL', 'CARDINAL', 'CARDINAL']","[22, 40, 64, 109, 117, 162, 187, 546]","[24, 43, 67, 112, 121, 163, 188, 547]",informed consent
C:\Users\shweata\dictionary\ethics_statement_project\stem_cell_2018\PMC6141688\sections\1_body\1_materials_and_methods\1_ethical_statement\1_p.xml,"Ethical approval (register number 09-210M, project number CFU-12/09) for the study was obtained from the Regional Ethical Review Board, Umeå, Sweden. All parts of the study were performed according to the Declaration of Helsinki. The patients were included after informed written consent.","[09, the Regional Ethical Review Board, Umeå, Sweden, the Declaration of Helsinki]","['CARDINAL', 'ORG', 'GPE', 'GPE', 'WORK_OF_ART']","[34, 101, 136, 142, 201]","[36, 134, 140, 148, 228]",informed written consent
C:\Users\shweata\dictionary\ethics_statement_project\stem_cell_2018\PMC6142101\sections\1_body\1_methods\3_design\1_p.xml,"Patients were enrolled by signing a consent form prior to transplantation. Three months following transplantation, upon consent, patients were allocated to the SYT group. Patients who were not interested in taking SYT were allocated to the control group. Both groups continued to receive standard biomedical care from their oncologist. Patients allocated to the treatment group were to receive a batch of SYT once each month for a duration of 6 months. Peripheral blood samples were collected and analyzed on a monthly basis.","[Three months, SYT, SYT, SYT, each month, 6 months, monthly]","['DATE', 'ORG', 'ORG', 'ORG', 'DATE', 'DATE', 'DATE']","[75, 160, 214, 405, 414, 443, 511]","[87, 163, 217, 408, 424, 451, 518]",consent form
C:\Users\shweata\dictionary\ethics_statement_project\stem_cell_2018\PMC6142101\sections\1_body\2_preliminary_results\1_patients\1_p.xml,"Patients from the Division of Hematology and Oncology of the China Medical University Hospital were consecutively enrolled in the trial from September 1, 2015, onwards. The study protocol was approved by the Institutional Review Board of the China Medical University Hospital (DMR-105-005), and all participants provided informed consent. The trial protocol was made public on 
 ","[the Division of Hematology, the China Medical University Hospital, September 1, 2015, the Institutional Review Board, the China Medical University Hospital]","['ORG', 'ORG', 'DATE', 'ORG', 'ORG']","[14, 57, 141, 204, 238]","[40, 94, 158, 234, 275]",informed consent
C:\Users\shweata\dictionary\ethics_statement_project\stem_cell_2018\PMC6153548\sections\1_body\1_patients_and_methods\1_study_design_and_particip\1_p.xml,"In this first-in-human, dose-escalation phase I trial, adult patients with relapsed or refractory NHL for whom standard measures did not exist or were no longer effective were enrolled from one European (Switzerland) and five US cancer center sites. To be eligible, patients had to be aged 18 years or older with a histologically confirmed diagnosis of lymphoma limited to DLBCL, FL, MCL, or MZL. Patients were also required to have received at least one prior anti-CD20 based therapeutic regimen, have a life expectancy of greater than 3 months, an Eastern Cooperative Oncology Group Performance status of 2 or lower, and adequate hematological, renal, and hepatic function. Prior therapies resulting in exclusion included chemotherapy or radiation within 3 weeks of study entry, radioimmunotherapy within 2 months of starting study drug, major surgery within 30 days, prior treatment with a CD37-directed agent, and allogenic stem cell transplantation. The trial was conducted in accordance with US Food and Drug Administration regulations, the International Conference on Harmonisation Guidelines for Good Clinical Practice, and the Declaration of Helsinki. The study was compliant with all relevant Institutional Review Board and Independent Ethics Committee requirements and all patients provided written informed consent for participation. The trial is registered at 
 ","[first, NHL, one, European, Switzerland, five, US, 18 years, MCL, MZL, at least one, greater than, Eastern Cooperative Oncology Group Performance, 2, 3 weeks, 2 months, 30 days, US Food and Drug Administration, the International Conference on Harmonisation Guidelines for Good Clinical Practice, the Declaration of Helsinki, Institutional Review Board, Independent Ethics Committee]","['ORDINAL', 'ORG', 'CARDINAL', 'NORP', 'GPE', 'CARDINAL', 'GPE', 'DATE', 'ORG', 'ORG', 'CARDINAL', 'CARDINAL', 'ORG', 'CARDINAL', 'DATE', 'DATE', 'DATE', 'ORG', 'ORG', 'WORK_OF_ART', 'ORG', 'ORG']","[8, 98, 190, 194, 204, 221, 226, 290, 384, 392, 442, 524, 550, 607, 757, 807, 861, 998, 1043, 1132, 1203, 1234]","[13, 101, 193, 202, 215, 225, 228, 298, 387, 395, 454, 536, 596, 608, 764, 815, 868, 1029, 1126, 1159, 1229, 1262]",informed consent
C:\Users\shweata\dictionary\ethics_statement_project\stem_cell_2018\PMC6160169\sections\1_body\1_materials_and_methods\2_treatment\1_p.xml,"Patients were treated according to national guidelines, which generally included chemotherapy with or without radiotherapy (
 ",[],[],[],[],national guidelines
C:\Users\shweata\dictionary\ethics_statement_project\stem_cell_2018\PMC6160169\sections\1_body\1_materials_and_methods\8_ethics\1_p.xml,"Ethical approval was obtained by the regional ethics committee in Uppsala, Sweden according to the declaration of Helsinki (2014/020, 2014/020/1, and 2014/233). Informed consent from participants was not required according to the ethics committee. All data were fully anonymized before accessed.","[Uppsala, Sweden, 2014/020/1, 2014/233]","['GPE', 'GPE', 'CARDINAL', 'CARDINAL']","[66, 75, 134, 150]","[73, 81, 144, 158]",ethics committee
